{
  "id": "base:bookshelf_divider_mk3",
  "type": "fixture",
  "name": "loc:fixture.bookshelf_divider_mk3",
  "category": "decor",
  "footprint": [
    2,
    1
  ],
  "cost": 306.0,
  "capacity": 12,
  "noise": -0.35,
  "upkeep_hours": 0.13,
  "zone": "any",
  "tags": [
    "decor",
    "quiet"
  ]
}
